{
  "schema_version": "case_intake_brief.v0",
  "case_id": "D-B-RT02",
  "session_id": "D-B-RT02-S05",
  "policy_profile": "dev_verbose",
  "plugin_type": "divorce",
  "title": "Information asymmetry used as leverage \u2014 active deflection of disclosure requests",
  "scenario_summary": "Two divorcing spouses are mediating a financial settlement. One spouse (Party A) has been the primary financial manager and holds all account information, business records, and asset documentation. Party A uses this information advantage actively \u2014 responding to disclosure requests with reframing (the information is complex), deflection (we can deal with details later), and authority claims (I understand these numbers better). Party B expresses mild concern but does not directly name the pattern. The session appears cooperative from the surface. The adversarial signal: the party with information is actively managing the disclosure gap rather than closing it.",
  "expected_mode_range": [
    "M1",
    "M2"
  ],
  "intended_challenge_type": "adversarial",
  "participant_snapshots": [
    {
      "participant_id": "spouse_A",
      "role_label": "Spouse A",
      "public_goals": [
        "Reach a settlement quickly \u2014 'we've been going back and forth for months, it's time to move forward.'",
        "Keep the business valuation process out of mediation scope \u2014 'that requires specialists.'",
        "Establish a settlement framework first, then fill in financial details later."
      ],
      "interest_profile": [],
      "starting_positions": []
    },
    {
      "participant_id": "spouse_B",
      "role_label": "Spouse B",
      "public_goals": [
        "Understand what assets exist before agreeing to a settlement.",
        "Not be rushed into decisions without information.",
        "Keep the process moving \u2014 wants to resolve this."
      ],
      "interest_profile": [],
      "starting_positions": []
    }
  ]
}
