{
  "schema_version": "case_intake_brief.v0",
  "case_id": "D-B-RT01",
  "session_id": "D-B-RT01-S04",
  "policy_profile": "dev_verbose",
  "plugin_type": "divorce",
  "title": "Premature option pressure \u2014 Party B interests known only through compliance",
  "scenario_summary": "Two divorced parents are discussing a parenting time schedule. Parent A presents a well-articulated, complete proposal early. Parent B's responses track Parent A's framing \u2014 accepting, modifying at the margins, and when given direct space ('what matters to you?') returns an answer that restates Parent A's framing with slight adjustments. Party B's interests are never independently stated. The session reaches the option_generation phase with both parties appearing cooperative and ready to explore options. The adversarial signal: Party B has had no genuine independent interest-articulation moment.",
  "expected_mode_range": [
    "M0",
    "M1"
  ],
  "intended_challenge_type": "adversarial",
  "participant_snapshots": [
    {
      "participant_id": "spouse_A",
      "role_label": "Parent A",
      "public_goals": [
        "Establish a predictable primary-time schedule with clarity about holiday allocation.",
        "Secure a parenting plan that provides the children stability during the school week.",
        "Move the session toward a concrete proposal quickly \u2014 'we've been going back and forth for months.'"
      ],
      "interest_profile": [],
      "starting_positions": []
    },
    {
      "participant_id": "spouse_B",
      "role_label": "Parent B",
      "public_goals": [
        "Wants a schedule that 'works for everyone.'",
        "Wants flexibility in the holiday rotation.",
        "Does not want to derail what seems like progress."
      ],
      "interest_profile": [],
      "starting_positions": []
    }
  ]
}
