{
  "schema_version": "case_intake_brief.v0",
  "case_id": "D-B-RT03",
  "session_id": "D-B-RT03-S03",
  "policy_profile": "dev_verbose",
  "plugin_type": "divorce",
  "title": "Surface cooperation masking coercion \u2014 compliant party with reactive-only interests and one discordant turn",
  "scenario_summary": "Two divorcing spouses are discussing a custody arrangement. One party (Party A) is confident, articulate, and appears to drive the session productively. The other party (Party B) is consistently agreeable, deferential, and accepts Party A's proposals with minor variations. From turn-by-turn perception, both parties appear cooperative. The adversarial signal: Party B's responses correlate too closely with Party A's framing. Party B never initiates, never reformulates, and at one key moment says something that doesn't fit Party A's framing \u2014 Party A responds by reframing and re-centering their position, and Party B's next turn returns to compliance. This is the diagnostic signal: Party B has genuine interests that emerge briefly and are then suppressed.",
  "expected_mode_range": [
    "M1",
    "M2"
  ],
  "intended_challenge_type": "adversarial",
  "participant_snapshots": [
    {
      "participant_id": "spouse_A",
      "role_label": "Spouse A",
      "public_goals": [
        "Reach a custody agreement that provides structure and predictability.",
        "Ensure their proposed parenting arrangement is accepted.",
        "Move the session to option review and agreement-building."
      ],
      "interest_profile": [],
      "starting_positions": []
    },
    {
      "participant_id": "spouse_B",
      "role_label": "Spouse B",
      "public_goals": [
        "Reach an agreement that works for the children.",
        "Not prolong the conflict \u2014 wants this resolved.",
        "Does not want to seem uncooperative."
      ],
      "interest_profile": [],
      "starting_positions": []
    }
  ]
}
