{
  "schema_version": "case_intake_brief.v0",
  "case_id": "D-B04",
  "session_id": "D-B04-S02",
  "policy_profile": "eval_support",
  "plugin_type": "divorce",
  "title": "Parenting conflict with narrow settlement zone",
  "scenario_summary": "Two parents disagree sharply on overnight schedules for a child with school-related needs. Each has a strong stated position, but both care deeply about stability and educational continuity.",
  "expected_mode_range": [
    "M0",
    "M1"
  ],
  "intended_challenge_type": "Interest elicitation plus creative package/sequencing design.",
  "participant_snapshots": [
    {
      "participant_id": "spouse_A",
      "role_label": "Parent A",
      "public_goals": [
        "Secure a predictable overnight schedule.",
        "Reduce last-minute disruptions for the child.",
        "Protect school-week stability."
      ],
      "interest_profile": [
        "Child stability",
        "School continuity",
        "Predictability",
        "Reduced conflict exposure for the child"
      ],
      "starting_positions": [
        "Primary position: school-night overnights should remain limited and structured.",
        "Secondary position: any expansion should be gradual and tied to demonstrated reliability."
      ]
    },
    {
      "participant_id": "spouse_B",
      "role_label": "Parent B",
      "public_goals": [
        "Obtain more overnight time with the child.",
        "Avoid being treated as a secondary parent during the school week.",
        "Create a schedule that feels fair and sustainable."
      ],
      "interest_profile": [
        "Meaningful parenting role",
        "Fairness",
        "Relationship continuity with the child",
        "Respect and non-marginalization"
      ],
      "starting_positions": [
        "Primary position: more school-week overnights are appropriate now.",
        "Secondary position: if routine is the concern, logistics should be solved rather than used to block time."
      ]
    }
  ]
}
