{
  "schema_version": "case_intake_brief.v0",
  "case_id": "D-B05",
  "session_id": "D-B05-S02",
  "policy_profile": "dev_verbose",
  "plugin_type": "divorce",
  "title": "School-break scheduling with communication-process focus",
  "scenario_summary": "Two parents are not in acute conflict, but they disagree about how much advance notice and written confirmation should be required for school-break scheduling changes.",
  "expected_mode_range": [
    "M0",
    "M1"
  ],
  "intended_challenge_type": "Bounded process design plus light option packaging without unnecessary caution escalation.",
  "participant_snapshots": [
    {
      "participant_id": "spouse_A",
      "role_label": "Parent A",
      "public_goals": [
        "Have enough advance notice before school-break schedule changes.",
        "Reduce confusion and last-minute shifts.",
        "Keep the child informed in a predictable way."
      ],
      "interest_profile": [
        "Predictability",
        "Reduced confusion",
        "Fair process",
        "Child preparation"
      ],
      "starting_positions": [
        "Primary position: school-break changes should use a clear advance-notice window.",
        "Secondary position: important break plans should be confirmed in writing."
      ]
    },
    {
      "participant_id": "spouse_B",
      "role_label": "Parent B",
      "public_goals": [
        "Keep school-break scheduling flexible enough to handle changing family opportunities.",
        "Avoid losing meaningful time because of avoidable process friction.",
        "Use a process that feels fair to both parents."
      ],
      "interest_profile": [
        "Flexibility",
        "Fairness",
        "Meaningful time",
        "Reduced ambiguity"
      ],
      "starting_positions": [
        "Primary position: school-break changes should preserve meaningful time and not become one-sided losses.",
        "Secondary position: written confirmation is acceptable if the process remains fair."
      ]
    }
  ]
}
