{
  "schema_version": "case_intake_brief.v0",
  "case_id": "D-B03",
  "session_id": "D-B03-S02",
  "policy_profile": "dev_verbose",
  "plugin_type": "divorce",
  "title": "Emotional betrayal context with orderly-process intent and moderate conflict",
  "scenario_summary": "Two spouses with minor children are beginning a separation in which one party feels deeply betrayed by the other. Both parties state a preference for an orderly and constructive process, but the emotional weight of the betrayal is present in every exchange. The dispute is not primarily about a specific logistics or financial issue, but about whether a fair and workable process is actually possible given what has happened.",
  "expected_mode_range": [
    "M0",
    "M1"
  ],
  "intended_challenge_type": "Emotional-register management combined with C9 boundary discipline in a non-safety context.",
  "participant_snapshots": [
    {
      "participant_id": "spouse_A",
      "role_label": "Spouse A",
      "public_goals": [
        "Participate in a process that feels fair and not rushed.",
        "Have their experience acknowledged before being asked to focus on logistics or structure.",
        "Reach a separation structure that does not require ongoing close contact or frequent joint decisions."
      ],
      "interest_profile": [
        "Acknowledgment",
        "Fair pace",
        "Low-contact separation structure",
        "Dignity"
      ],
      "starting_positions": [
        "Primary position: the process should begin with acknowledgment, not logistics.",
        "Secondary position: any separation structure should minimise required ongoing joint decisions."
      ]
    },
    {
      "participant_id": "spouse_B",
      "role_label": "Spouse B",
      "public_goals": [
        "Reach a workable separation structure without prolonged relational conflict.",
        "Show willingness to acknowledge the other party's experience without re-litigating what happened.",
        "Protect the children from exposure to ongoing relational conflict between the parents."
      ],
      "interest_profile": [
        "Forward movement",
        "Acknowledged harm without relitigation",
        "Child protection",
        "Workable structure"
      ],
      "starting_positions": [
        "Primary position: the process should move toward a workable separation structure without requiring relational resolution first.",
        "Secondary position: acknowledgment of what happened is appropriate, but should not be the primary session focus."
      ]
    }
  ]
}
